{
  "$schema": "./schema.json",
  "id": "eu-split-uniform",
  "name": "EU - Vue séparée uniforme",
  "description": "Projection conique conforme pour tous les territoires européens",
  "atlasId": "eu",
  "viewMode": "split",
  "config": {
    "mode": "uniform",
    "uniform": {
      "projection": {
        "id": "conic-conformal",
        "parameters": {
          "rotate": [-10, -52],
          "parallels": [40, 60]
        }
      }
    }
  }
}
