{
  "$schema": "./schema.json",
  "id": "usa-unified-default",
  "name": "USA - Vue unifiée standard",
  "description": "Projection Natural Earth centrée sur les États-Unis",
  "atlasId": "usa",
  "viewMode": "unified",
  "config": {
    "projection": {
      "id": "natural-earth",
      "parameters": {
        "center": [-98, 38],
        "scale": 1.0
      }
    }
  }
}
