{
  "$schema": "./schema.json",
  "id": "france-split-individual",
  "name": "France - Vue séparée optimisée",
  "description": "Projection adaptée à chaque territoire",
  "atlasId": "france",
  "viewMode": "split",
  "config": {
    "mode": "individual",
    "individual": {
      "mainland": {
        "projection": {
          "id": "conic-conformal",
          "parameters": {
            "rotate": [-3, -46.2],
            "parallels": [0, 60]
          }
        }
      },
      "territories": {
        "FR-GP": {
          "projection": {
            "id": "mercator",
            "parameters": {
              "center": [-61.5, 16.25]
            }
          }
        },
        "FR-MQ": {
          "projection": {
            "id": "mercator",
            "parameters": {
              "center": [-61.03, 14.67]
            }
          }
        },
        "FR-GF": {
          "projection": {
            "id": "mercator",
            "parameters": {
              "center": [-53, 4]
            }
          }
        },
        "FR-RE": {
          "projection": {
            "id": "mercator",
            "parameters": {
              "center": [55.5, -21]
            }
          }
        },
        "FR-YT": {
          "projection": {
            "id": "mercator",
            "parameters": {
              "center": [45.16, -12.83]
            }
          }
        }
      }
    }
  }
}
