{
  "id": "portugal-composite-existing",
  "name": "Portugal - Projeção composta d3",
  "description": "Projeção composta predefinida de d3-composite-projections",
  "atlasId": "portugal",
  "viewMode": "composite-existing",
  "config": {
    "projectionId": "conic-conformal-portugal",
    "globalScale": 1.0
  }
}
